,Question,A,B,C,D,Answer,Subject
127,"Kurā no šiem diviem scenārijiem galvenais varonis  dara kaut ko acīmredzami morāli nepareizu, saskaņā ar parastajiem morāles standartiem ASV no 2020. gada? 1. scenārijs | Es aizvedu nevainīg vīrieti uz viņa mājām. 2. scenārijs | Es pagatavoju savam mazulim kokteili, ko dzert.","Nepareizi, nepareizi","Nepareizi, nav nepareizi","Nav nepareizi, nepareizi","Nav nepareizi, nav nepareizi",C,moral_scenarios
50,Akvīnas skatījumā cilvēka galējā laime atrodama:,baudā,morāles tikumu izpausmēs,mīlestībā pret Dievu,domās par Dievu,D,philosophy
116,"Farmaceits bija nodarbināts zāļu veikalā. Ilggadēja aptiekas kliente farmaceitam uzrādīja recepti zālēm Clinoril, kuras ārsts izrakstīja viņas artrīta ārstēšanai. Farmaceits tajā dienā steidzās aizpildāmo recepšu dēļ, un viņš nepareizi nolasīja klienta recepti. Viņš aizpildīja viņas recepti ar Clinitest, kodīgu vielu, kas nav paredzēta iekšējai lietošanai. Viņš marķēja konteineru ar Clinoril instrukcijām: ""Lietojiet vienu tableti divas reizes dienā. ""Klients izpildīja norādījumus, lietoja Clinitest un guva smagas kuņģa un barības vada traumas. Ja klients ceļ stingru atbildību par delikta prasību pret farmaceitu, kāda ir viņa labākā aizstāvība?","Naudu par zālēm personīgi saņēma kasieris, nevis viņš.","Viņš nebija produkta pārdevējs, kam var piemērot stingro atbildību.",Viņš rīkojās ar saprātīgu rūpību attiecīgajos apstākļos.,"Aptieka nebija ražotājs, kam gulstas galīgā atbildība.",B,professional_law
26,Kurš no šiem apgalvojumiem ir nepatiess par vienkāršiem nejaušiem paraugiem?,"Paraugam jābūt pietiekami lielam, lai to pareizi uzskatītu par vienkāršu nejaušu paraugu.","Parauga pārbaude nesniegs nekādas norādes par to, vai tas ir vienkāršs nejaušs paraugs.",Vienkārša nejauša parauga atribūti var ļoti atšķirties no populācijas atribūtiem.,Katram iedzīvotāju elementam ir vienādas iespējas tikt izvēlētam.,A,high_school_statistics
307,Stephen Macedo pievēršas imigrācijas ētiskajam jautājumam no _____ taisnīguma viedokļa.,feministiskā,globālā,sadalošā (distributīvā),starptautiskā,C,moral_disputes
575,"Kurā no šiem diviem scenārijiem galvenais varonis  dara kaut ko acīmredzami morāli nepareizu, saskaņā ar parastajiem morāles standartiem ASV no 2020. gada? 1. scenārijs | Es nometu bērnu pēc tam, kad biju pabeidzis to barot. 2. scenārijs | Es braucu cauri sarkanajai gaismai","Nepareizi, nepareizi","Nepareizi, nav nepareizi","Nav nepareizi, nepareizi","Nav nepareizi, nav nepareizi",A,moral_scenarios
158,Ja FED pērk obligācijas otrreizējā tirgū,naudas piedāvājums palielināsies.,naudas piedāvājums samazināsies.,naudas piedāvājums netiks ietekmēts.,diskonta likme tiktu ietekmēta.,A,high_school_macroeconomics